{"contradiction_id":"BK-CON-001","focus_object_id":"BK-ENT-001","conflicting_references":[{"id":"BK-OBS-014","type":"Observation","source_asset_id":"EK-BANK-RHYP-001"},{"id":"BK-OBS-047","type":"Observation","source_asset_id":"EK-BANK-RHYP-001"}],"contradiction_statement":"For Lloyds, branch and assisted-access assets can be interpreted as cost pressure and as trust or inclusion assets; Increment 1 preserves both readings without resolving them.","status":"open","materiality":"presentation constraint","authority_status":"candidate","lifecycle_status":"Open","evidence_references":[{"id":"SDOC-1AAA2EF8E20A","type":"Source","source_asset_id":"EK-BANK-RHYP-001"}],"observation_references":[{"id":"BK-OBS-014","type":"Observation","source_asset_id":"EK-BANK-RHYP-001"},{"id":"BK-OBS-047","type":"Observation","source_asset_id":"EK-BANK-RHYP-001"}],"provenance":"docs/Semantic_Banking_Completion_Report.md","human_review_status":"not_reviewed_in_increment_1","resolution_history":[]}
